{
  "actor": {
    "kind": "agent",
    "id": "anthropic/claude-code",
    "provider": "anthropic",
    "model": "unknown",
    "runtime": "claude-code"
  },
  "identity": {
    "provider": "anthropic",
    "model": null,
    "modelVersion": null,
    "runtime": "claude-code",
    "runtimeVersion": null,
    "sessionId": "00000000-0000-0000-0000-000000000000",
    "conversationId": null,
    "runId": null,
    "agentId": null,
    "subagentId": null
  },
  "discovery": {
    "mechanism": "whitelisted-claude-environment",
    "actorKindSource": "discovery-mechanism"
  },
  "activeExecutions": [
    {
      "executionId": "EXE-20260926T204846052Z-8cef0d1e",
      "workItemId": "FEAT-ECHELON-PROVENANCE",
      "startedAt": "2026-09-26T20:48:46.052Z",
      "actor": {
        "kind": "agent",
        "id": "anthropic/claude-code",
        "provider": "anthropic",
        "model": "unknown",
        "runtime": "claude-code"
      }
    }
  ],
  "assurance": "self-reported"
}
